{
  "label_eq": "eq:spec_prim",
  "formula": "P_R(k; α) = A_s(α) k^{n_s(α)-1}",
  "description": "Spectre primordial modifié MCGT - paramètres de référence (Planck 2018).",
  "constants": {
    "A_s0": 2.1e-09,
    "ns0": 0.9649
  },
  "coefficients": {
    "c1": 1.0,
    "c2": -0.04,
    "c1_2": 0.0,
    "c2_2": 0.0
  }
}